Question no,Question,ans,ans1,ans2,ans3,ans4,help
1,What is the capital of Engalnd?,B,Birmingham,London,Southhampton,Oxford,This city has the highest population
2,How many states are there in America?,A,50,51,52,53,each star on the flag represents a state
3,Which is the capital of Russia?,A,Moscow,Saint Petersburg,Novosibirsk,Yekaterinburg,This city has the highest population
4,How many countries share a border with France?,C,4,5,6,7,there are at least 5 countries
5,Which country has the highest population,D,Brazil,USA,India,China,This country is the center for most manufacturing of goods.
